{
  "report_id": "CONF-2026-0001",
  "runtime_name": "ExampleRuntime",
  "runtime_version": "1.4.2",
  "open_rta_version": "0.1.0",
  "supported_laws": [
    "01-no-rogue-autonomy",
    "02-observable-execution",
    "03-interruptible-control",
    "04-replayable-behavior"
  ],
  "evidence": {
    "objective": "examples/minimal-objective.json",
    "authority": "examples/minimal-authority.json",
    "trace": "examples/minimal-trace.json",
    "oversight": "examples/minimal-oversight-record.json",
    "control": "examples/minimal-control-record.json",
    "replay": "examples/minimal-replay-record.json"
  },
  "limitations": [
    "Pause requests in physical subsystems may take up to 2 seconds to apply"
  ],
  "declared_at": "2026-03-21T10:30:00Z"
}
